{
  "schemaVersion": 1,
  "schema": "equipment",
  "notes": "Phobos Manufacturing charge machines: footprint, dry mass, idle and working power, the share of the working power that warms the room, feed-bin cells, art, INSTALL tab and use and power points (pixels from the centre). A read-only reference for now: a saved machine's mass and footprint depend on these, so a player file that changes one is refused. Balance record: docs/development/manufacturing-refinery-and-chemistry.md.",
  "equipment": {
    "PhobosVolatilesRefinery": {
      "notes": "Fennmark V4 Volatiles Refinery: an electric hearth and drying retort, one exact charge at a time.",
      "kind": "charge-machine",
      "footprint": 4,
      "massKg": 180,
      "idleKW": 0.1,
      "workingKW": 24,
      "roomHeatFraction": 0.15,
      "feedCells": 6,
      "art": "PhobosVolatilesRefinery",
      "installTab": "APPS",
      "points": { "use": [ 0, -40 ], "PowerA": [ -24, 40 ], "PowerB": [ 24, 40 ] }
    },
    "PhobosLeachUnit": {
      "notes": "Lixivar LC-3 Leach and Crystallise Unit: a heated leach tank and a closed crystalliser with condensate recovery, one selected charge at a time. 12 kW sets every recipe's energy through its seconds.",
      "kind": "charge-machine",
      "footprint": 3,
      "massKg": 220,
      "idleKW": 0.1,
      "workingKW": 12,
      "roomHeatFraction": 0.15,
      "feedCells": 4,
      "art": "PhobosLeachUnit",
      "installTab": "APPS",
      "points": { "use": [ 0, -32 ], "PowerA": [ 0, 32 ] }
    },
    "PhobosAcidPlant": {
      "notes": "Lixivar SA-3 Sulfuric Acid Plant: a fluidised-bed roaster, a converter bed and an absorption tower, one nodule at a time. Its 4 kW runs the blowers, preheat and pumps; the reactions themselves release about 21.1 kWh a charge into the room.",
      "kind": "charge-machine",
      "footprint": 3,
      "massKg": 260,
      "idleKW": 0.1,
      "workingKW": 4,
      "roomHeatFraction": 0.15,
      "feedCells": 2,
      "art": "PhobosAcidPlant",
      "installTab": "APPS",
      "points": { "use": [ 0, -32 ], "PowerA": [ 0, 32 ] }
    },
    "PhobosFermenterStill": {
      "notes": "Alembrine Copperhead-3 Fermenter-Still (Manufacturing 0.39.0): two fermentation vats, a copper pot still and a condenser, one charge of beets or sugar at a time. Its 3 kW heats the still and runs the pumps; nearly all of it ends up in the room through the condenser.",
      "kind": "charge-machine",
      "footprint": 3,
      "massKg": 320,
      "idleKW": 0.1,
      "workingKW": 3,
      "roomHeatFraction": 0.9,
      "feedCells": 6,
      "art": "PhobosFermenterStill",
      "installTab": "APPS",
      "points": { "use": [ 0, -32 ], "PowerA": [ 0, 32 ] }
    }
  }
}
